{
  "accounting": {
    "mutants": {
      "accepted": 0,
      "cataloged": 10,
      "equivalent": 0,
      "executed": 9,
      "killed": 7,
      "rejected": 0,
      "reused_killed": 0,
      "reused_survived": 0,
      "survived": 2,
      "timed_out": 0,
      "unreached": 1
    },
    "soundness": {
      "executed": false,
      "packages_with_unsafe": 0,
      "unsafe_items": 0
    },
    "targets": {
      "failed": 0,
      "missing": 0,
      "passed": 2,
      "selected": 2,
      "skipped": 0
    }
  },
  "candidates": [],
  "contract": "standard-v1",
  "findings": [
    {
      "detail": "no test could have noticed gt-to-ge@1 at src/lib.rs:8: every one of the 1 targets that reach it was removed without being run, by never-infected",
      "kind": "surviving-mutant",
      "path": "src/lib.rs",
      "position": {
        "character_column": 10,
        "column": 10,
        "line": 8
      },
      "subject": "366948fbe36bfd19786d"
    },
    {
      "detail": "no test could have noticed lt-to-le@1 at src/lib.rs:10: every one of the 1 targets that reach it was removed without being run, by never-infected",
      "kind": "surviving-mutant",
      "path": "src/lib.rs",
      "position": {
        "character_column": 17,
        "column": 17,
        "line": 10
      },
      "subject": "2bcb6eb7d96056277fa1"
    },
    {
      "detail": "no measured target reaches return-default@1 at src/lib.rs: each of them was measured, was asked, and answered that nothing of it executes the position",
      "kind": "surviving-mutant",
      "path": "src/lib.rs",
      "position": {
        "character_column": 9,
        "column": 9,
        "line": 13
      },
      "subject": "97b5a75a9e1efeeff233"
    }
  ],
  "limitations": [
    {
      "detail": "git could not be asked, so the run cannot name the commit it verified",
      "name": "git-metadata-unavailable"
    },
    {
      "detail": "the target's guards recorded nothing this run can route by, so every test of it reaches every mutation in it and none of them is narrowed (fixture-baseline/doc/fixture_baseline)",
      "name": "touch-not-recorded"
    },
    {
      "detail": "1 place was not mutated: test-code",
      "name": "skipped-test-code"
    }
  ],
  "mutants": [
    {
      "display_id": "0cb3400e6fea6d01b5b0",
      "id": "0cb3400e6fea6d01b5b03bb8184b305aedbe265b49c32cb61560a7afa2ae6d65",
      "killed_by": "fixture-baseline/lib/fixture_baseline",
      "outcome": "killed",
      "path": "src/lib.rs",
      "position": {
        "character_column": 5,
        "column": 5,
        "line": 8
      },
      "reused": false,
      "rule": "return-default@1",
      "source_run_id": null
    },
    {
      "display_id": "2bcb6eb7d96056277fa1",
      "id": "2bcb6eb7d96056277fa103492ff96c0d2aac9bdbcb6631aa89793025fc77c4a0",
      "killed_by": null,
      "outcome": "survived",
      "path": "src/lib.rs",
      "position": {
        "character_column": 17,
        "column": 17,
        "line": 10
      },
      "reused": false,
      "rule": "lt-to-le@1",
      "source_run_id": null
    },
    {
      "display_id": "366948fbe36bfd19786d",
      "id": "366948fbe36bfd19786d81fbae6446524d338a866fb8e99a17def9f50fd3485d",
      "killed_by": null,
      "outcome": "survived",
      "path": "src/lib.rs",
      "position": {
        "character_column": 10,
        "column": 10,
        "line": 8
      },
      "reused": false,
      "rule": "gt-to-ge@1",
      "source_run_id": null
    },
    {
      "display_id": "9618aa1c71c281ae9835",
      "id": "9618aa1c71c281ae983584d26d09b1411bae1974fad571eb0a814eb4b44a2f17",
      "killed_by": "fixture-baseline/lib/fixture_baseline",
      "outcome": "killed",
      "path": "src/lib.rs",
      "position": {
        "character_column": 15,
        "column": 15,
        "line": 10
      },
      "reused": false,
      "rule": "negate-condition@1",
      "source_run_id": null
    },
    {
      "display_id": "97b5a75a9e1efeeff233",
      "id": "97b5a75a9e1efeeff23366ed26389245afc47b6091c7a2595eca2eb5cd052886",
      "killed_by": null,
      "outcome": "unreached",
      "path": "src/lib.rs",
      "position": {
        "character_column": 9,
        "column": 9,
        "line": 13
      },
      "reused": false,
      "rule": "return-default@1",
      "source_run_id": null
    },
    {
      "display_id": "ae6162ece39e3389335d",
      "id": "ae6162ece39e3389335db4344482a86f8b7e93863b0b492fdf8868cea5b12c7b",
      "killed_by": "fixture-baseline/lib/fixture_baseline",
      "outcome": "killed",
      "path": "src/lib.rs",
      "position": {
        "character_column": 8,
        "column": 8,
        "line": 8
      },
      "reused": false,
      "rule": "negate-condition@1",
      "source_run_id": null
    },
    {
      "display_id": "b6f6f7454e99e11dfd80",
      "id": "b6f6f7454e99e11dfd807eeea7e2e121461d68b588ccb1a0015d6e75d32adfb1",
      "killed_by": "fixture-baseline/lib/fixture_baseline",
      "outcome": "killed",
      "path": "src/lib.rs",
      "position": {
        "character_column": 9,
        "column": 9,
        "line": 9
      },
      "reused": false,
      "rule": "return-default@1",
      "source_run_id": null
    },
    {
      "display_id": "d0f665a548910bd9ed45",
      "id": "d0f665a548910bd9ed45eae5a3c02fa1e5b826af1bf0ed2ae01a52d493a3961e",
      "killed_by": "fixture-baseline/test/doubling",
      "outcome": "killed",
      "path": "src/lib.rs",
      "position": {
        "character_column": 7,
        "column": 7,
        "line": 19
      },
      "reused": false,
      "rule": "mul-to-div@1",
      "source_run_id": null
    },
    {
      "display_id": "ee0a61bc9f91d9acc4cf",
      "id": "ee0a61bc9f91d9acc4cf69d15879a1df1d4f7892ef853789a1d98cff5979cd4e",
      "killed_by": "fixture-baseline/lib/fixture_baseline",
      "outcome": "killed",
      "path": "src/lib.rs",
      "position": {
        "character_column": 9,
        "column": 9,
        "line": 11
      },
      "reused": false,
      "rule": "return-default@1",
      "source_run_id": null
    },
    {
      "display_id": "f0bd7961d77aed7f5cba",
      "id": "f0bd7961d77aed7f5cbad88497803bfdca9aec313cb41c9f0e970f7861d756a2",
      "killed_by": "fixture-baseline/test/doubling",
      "outcome": "killed",
      "path": "src/lib.rs",
      "position": {
        "character_column": 5,
        "column": 5,
        "line": 19
      },
      "reused": false,
      "rule": "return-default@1",
      "source_run_id": null
    }
  ],
  "provenance": {
    "cached": false,
    "identity": "<volatile>",
    "source_run_id": null
  },
  "repository": {
    "configuration_digest": "<volatile>",
    "git": {
      "available": false,
      "branch": "<volatile>",
      "changed_files": [],
      "commit": "<volatile>",
      "dirty": false,
      "merge_base": null
    },
    "packages": [
      "fixture-baseline"
    ],
    "root_name": "<volatile>",
    "workspace_digest": "<volatile>"
  },
  "resources": [],
  "run_id": "<volatile>",
  "run_kind": "full",
  "schema": "mjutest-assurance-report-v1",
  "schema_version": 1,
  "scope": {
    "excluded": [],
    "requested_packages": [],
    "resolved_packages": []
  },
  "targets": [
    {
      "duration_ms": 0,
      "id": "7eda259a9d2ddb6f",
      "message": null,
      "name": "fixture-baseline/lib/fixture_baseline",
      "package": "fixture-baseline",
      "status": "passed"
    },
    {
      "duration_ms": 0,
      "id": "99ae8d4f8ec293f6",
      "message": null,
      "name": "fixture-baseline/test/doubling",
      "package": "fixture-baseline",
      "status": "passed"
    }
  ],
  "timing": {
    "duration_ms": 0,
    "finished": "<volatile>",
    "started": "<volatile>"
  },
  "tool": {
    "mjutest": "<volatile>",
    "rust_mutants": "<volatile>"
  },
  "toolchain": {
    "arch": "<volatile>",
    "cargo": "<volatile>",
    "os": "<volatile>",
    "rustc": "<volatile>",
    "target": "<volatile>"
  },
  "verdict": "INSUFFICIENT"
}
