{
  "schema": "mjutest-assurance-report-v1",
  "schema_version": 1,
  "run_id": "20260905T081500Z-abcdef",
  "run_kind": "changed",
  "contract": "deep-v1",
  "verdict": "CHANGE_ASSURED",
  "tool": {
    "mjutest": "0.1.0",
    "rust_mutants": "0.1.0"
  },
  "toolchain": {
    "rustc": "rustc 1.98.0 (0123456789 2026-01-01)",
    "cargo": "cargo 1.98.0 (0123456789 2026-01-01)",
    "target": "x86_64-unknown-linux-gnu",
    "os": "linux",
    "arch": "x86_64"
  },
  "repository": {
    "root_name": "fixture-workspace",
    "packages": [
      "app",
      "core"
    ],
    "workspace_digest": "aaaaaaaaaaaaaaaaaaaaaaaaaaaaaaaaaaaaaaaaaaaaaaaaaaaaaaaaaaaaaaaa",
    "configuration_digest": "bbbbbbbbbbbbbbbbbbbbbbbbbbbbbbbbbbbbbbbbbbbbbbbbbbbbbbbbbbbbbbbb",
    "git": {
      "available": true,
      "commit": "0123456789abcdef0123456789abcdef01234567",
      "branch": "main",
      "dirty": true,
      "merge_base": "fedcba9876543210fedcba9876543210fedcba98",
      "changed_files": [
        "crates/core/src/lib.rs"
      ]
    }
  },
  "provenance": {
    "identity": "ffffffffffffffffffffffffffffffffffffffffffffffffffffffffffffffff",
    "cached": false,
    "source_run_id": null
  },
  "scope": {
    "requested_packages": [
      "core"
    ],
    "resolved_packages": [
      "core"
    ],
    "excluded": [
      "**/generated/**"
    ]
  },
  "timing": {
    "started": "2026-09-05T08:15:00Z",
    "finished": "2026-09-05T08:16:12Z",
    "duration_ms": 72000
  },
  "accounting": {
    "targets": {
      "selected": 2,
      "passed": 1,
      "failed": 0,
      "skipped": 1,
      "missing": 0
    },
    "mutants": {
      "cataloged": 9,
      "rejected": 1,
      "executed": 8,
      "killed": 7,
      "survived": 1,
      "timed_out": 0,
      "unreached": 0,
      "equivalent": 0,
      "accepted": 1,
      "reused_killed": 2,
      "reused_survived": 0
    },
    "soundness": {
      "unsafe_items": 3,
      "packages_with_unsafe": 1,
      "executed": true
    }
  },
  "resources": [
    {
      "capability": "postgres",
      "instance": "pg-1",
      "environment": [
        "DATABASE_URL"
      ]
    }
  ],
  "candidates": [
    {
      "finding": "aaaaaaaaaaaaaaaaaaaaaaaaaaaaaaaaaaaaaaaaaaaaaaaaaaaaaaaaaaaaaaaa",
      "mutant": "aaaaaaaaaaaaaaaaaaaaaaaaaaaaaaaaaaaaaaaaaaaaaaaaaaaaaaaaaaaaaaaa",
      "kind": "patch",
      "path": "tests/closes.rs",
      "digest": "bbbbbbbbbbbbbbbbbbbbbbbbbbbbbbbbbbbbbbbbbbbbbbbbbbbbbbbbbbbbbbbb",
      "preimage": null,
      "stability_runs": 3,
      "kill_runs": 2,
      "accepted": true,
      "why": null
    }
  ],
  "targets": [
    {
      "id": "0123456789abcdef",
      "name": "core/lib/adds::works",
      "package": "core",
      "status": "passed",
      "duration_ms": 40,
      "message": null
    },
    {
      "id": "fedcba9876543210",
      "name": "core/test/it::slow",
      "package": "core",
      "status": "skipped",
      "duration_ms": 0,
      "message": "libtest ignored it"
    }
  ],
  "mutants": [
    {
      "id": "cccccccccccccccccccccccccccccccccccccccccccccccccccccccccccccccc",
      "display_id": "cccccccc",
      "path": "crates/core/src/lib.rs",
      "position": {
        "line": 12,
        "column": 9,
        "character_column": 9
      },
      "rule": "lt-to-le@1",
      "outcome": "killed",
      "killed_by": "0123456789abcdef",
      "reused": true,
      "source_run_id": "20260904T101500Z-123456"
    }
  ],
  "findings": [],
  "limitations": [
    {
      "name": "doctests-not-routed",
      "detail": "doctests run once and are not routed to mutants"
    }
  ]
}
